,Filename,Insertions,Deletions,Substitutions,WER,Word Count,transcription,Viterbi transcription,Decode speed,Backtrace speed,Forward computations
265,0265.wav,9,0,2,3.6666666666666665,3,piper picked peppers,the the picked a picked picked the the of where's of the,1.4063491821289062,0.00018024444580078125,57618
266,0266.wav,6,0,3,1.5,6,where's peter piper pickled picked peppers,the piper of the the piper of pickled picked the where's the,1.907745361328125,0.0005280971527099609,79038
267,0267.wav,6,0,3,1.5,6,the peck of peppers peter picked,the the of a of of of where's picked a of the,1.3983659744262695,0.0002148151397705078,57618
268,0268.wav,6,0,4,1.6666666666666667,6,where's the pickled peck of peppers,the the peter the the the of of of of where's the,2.208810329437256,0.0007023811340332031,57618
269,0269.wav,5,0,0,1.0,5,peter piper picked pickled peppers,peck the peter of piper of picked pickled peppers the,2.516836166381836,0.0009386539459228516,102348
270,0270.wav,6,0,0,2.0,3,peter picked piper,peck the the peter picked picked piper peck the,1.6767549514770508,0.00046944618225097656,66438
271,0271.wav,3,0,1,1.0,4,picked peppers picked piper,the a picked where's picked piper the,2.0880773067474365,0.0006847381591796875,82608
272,0272.wav,6,0,3,1.5,6,where's the pickled peppers piper picked,picked the where's the picked of where's piper of a peter the,2.2163705825805664,0.0007414817810058594,89748
273,0273.wav,7,0,5,1.7142857142857142,7,peck of picked peppers piper peter picked,picked the picked a peck where's piper of the the of a the the,3.8458452224731445,0.0014107227325439453,105918
274,0274.wav,3,0,0,0.75,4,peter piper picked peppers,picked the peter piper picked peppers the,2.3325650691986084,0.0005509853363037109,95838
275,0275.wav,4,0,0,1.3333333333333333,3,pickled peppers picked,picked the pickled peppers a picked the,1.5513274669647217,0.0003559589385986328,62868
276,0276.wav,4,0,1,0.7142857142857143,7,peter piper picked a peck of peppers,picked the peter piper picked of peck of peck peppers the,2.4100289344787598,0.0007448196411132812,99828
277,0277.wav,3,0,0,0.75,4,piper picked pickled peppers,picked the piper picked pickled peppers the,1.8418350219726562,0.00021767616271972656,76518
278,0278.wav,2,0,0,0.5,4,peter piper pickled peppers,the peter piper pickled peppers the,1.8540563583374023,0.0002720355987548828,76518
279,0279.wav,4,1,1,1.5,4,peck the peppers peck,the a picked of where's peck the,2.2969768047332764,0.0008428096771240234,93948
280,0280.wav,4,0,2,1.2,5,piper the piper pickled peppers,peck the where's the piper of pickled where's the,2.2069122791290283,0.00020122528076171875,92058
281,0281.wav,6,0,4,1.4285714285714286,7,peter picked piper picked the picked peppers,the a of picked the of pickled the picked the a where's the,2.2555458545684814,0.0007805824279785156,92058
282,0282.wav,4,0,1,1.0,5,pickled piper peppers pickled peter,the pickled piper of where's pickled peter picked the,1.8568429946899414,0.0001811981201171875,77148
283,0283.wav,10,0,7,1.0,17,piper peter picked a peck of pickled peppers where's the peck of pickled peppers piper peter picked,peck the where's of the the a picked of peck of the picked where's where's the peck of pickled where's piper the the of the picked the,3.004657745361328,0.0011959075927734375,122088
284,0284.wav,3,0,0,1.5,2,the peck,peck the peck picked the,1.394397258758545,0.0004780292510986328,55728
285,0285.wav,4,0,0,1.0,4,where's the peck peter,a the where's the peck peter picked the,2.162590980529785,0.0007054805755615234,57618
286,0286.wav,2,0,0,0.6666666666666666,3,piper pickled peppers,the piper pickled peppers the,1.5382816791534424,0.00022864341735839844,62868
287,0287.wav,5,0,2,0.875,8,a peck of pickled peppers peter piper picked,peck the of peck of pickled the of where's peter piper picked the,2.08105731010437,0.0004820823669433594,84498
288,0288.wav,4,0,1,0.8333333333333334,6,peppers pickled a peck picked peter,peck the peppers pickled of peck picked peter picked the,1.9955360889434814,0.0007686614990234375,80928
289,0289.wav,5,0,1,2.0,3,peter picked peppers,peck the picked where's peck picked peppers the,1.2560515403747559,0.0001423358917236328,50268
290,0290.wav,5,0,1,1.5,4,peck of pickled peppers,picked the peck of pickled peck where's the a,1.3239848613739014,0.00014352798461914062,54048
291,0291.wav,5,0,1,2.0,3,where's peter piper,peck the where's a of piper picked the,1.2891840934753418,0.0007688999176025391,48588
292,0292.wav,3,0,0,0.75,4,pickled peck of peppers,picked the pickled peck of peppers the,1.9264764785766602,0.00032258033752441406,66438
293,0293.wav,6,0,2,1.6,5,peter piper picked a peck,peck the picked where's piper a the peck peck picked the,2.706636428833008,0.0010488033294677734,70008
294,0294.wav,4,0,0,0.8,5,peppers of piper peck peter,peck the peppers of piper peck peter where's the,3.4733572006225586,0.0020706653594970703,130908
295,0295.wav,5,0,1,1.0,6,peter a piper of a peck,where's the peter of piper of picked a peck the the,1.8639509677886963,0.00021004676818847656,77148
296,0296.wav,4,0,1,1.25,4,peck pickled peter peck,the the peck pickled picked of peck the,2.009549379348755,0.0005140304565429688,82608
297,0297.wav,7,0,1,0.8888888888888888,9,a piper of peter picked peppers of pickled peter,pickled a piper picked the of peter picked picked of where's of pickled peter picked the,3.813786506652832,0.0010783672332763672,123768
298,0298.wav,4,0,3,1.4,5,of peck a peter pickled,where's the pickled peck picked picked of pickled the,2.2980411052703857,0.0005488395690917969,93318
299,0299.wav,2,0,1,0.42857142857142855,7,piper picked a peck of the peppers,piper picked picked of peck of the peppers the,1.2515826225280762,0.0004584789276123047,50268
300,0300.wav,2,0,0,0.6666666666666666,3,where's peter piper,the where's peter piper the,1.3516688346862793,0.0002009868621826172,55728
301,0301.wav,2,0,0,0.5,4,pickled peppers of peter,pickled peppers of peter picked the,1.091705322265625,0.00011134147644042969,43128
302,0302.wav,3,0,2,0.625,8,a peck of pickled peppers of peter piper,the of peck of pickled where's of peter piper picked the,2.3011081218719482,0.0009136199951171875,61188
303,0303.wav,3,0,2,1.0,5,peppers peppers peppers peppers peppers,peppers of where's peppers peppers of where's the,1.4533817768096924,0.0002219676971435547,59298
304,0304.wav,2,0,0,0.4,5,peter peck the pickled peppers,picked the peter peck the pickled peppers,1.3729722499847412,0.0002620220184326172,54048
305,0305.wav,2,1,0,0.6,5,pickled peter picked the piper,picked pickled peter picked piper picked,1.1704039573669434,0.0005023479461669922,48588
306,0306.wav,2,0,1,0.42857142857142855,7,where's the peck of peppers peter picked,peck the where's of peck of peppers peter picked,1.5018064975738525,0.0006031990051269531,61188
307,0307.wav,3,0,2,0.8333333333333334,6,the peppers pickled peter peppers piper,a picked peppers pickled peter peppers a picked the,1.6019508838653564,0.0006098747253417969,64758
308,0308.wav,6,0,2,1.3333333333333333,6,peppers peck peppers picked peppers peter,a peck of where's peck peppers picked of where's peter the picked,1.7327406406402588,0.0005464553833007812,68328
309,0309.wav,19,0,5,1.5,16,peter piper picked a peck of pickled peppers the peck of pickled peppers peter piper picked,peck the picked the the the picked piper of pickled of peck of pickled peppers where's the peck of picked picked picked where's peter of piper peck picked the of picked the of pickled of,7.537182331085205,0.0037012100219726562,303108
310,0310.wav,20,1,6,1.588235294117647,17,peter piper picked a peck of pickled peppers where's the peck of pickled peppers peter piper picked,the the the of peter a the of piper the a pickled where's peck pickled where's where's peck of of peppers peppers peter a of the a of peck where's picked the picked picked where's the,5.215463638305664,0.0018570423126220703,213438
311,0311.wav,15,0,2,3.4,5,a peck of pickled peppers,picked the where's the the the the of peck of the pickled of the where's piper the the the the,2.7133710384368896,0.0007605552673339844,111378
312,0312.wav,6,0,1,2.3333333333333335,3,where's peter piper,pickled the the where's peter the the a the,1.3852243423461914,0.00012183189392089844,57618
313,0313.wav,10,0,2,3.0,4,peter picked pickled peppers,pickled picked the the a the pickled pickled the the picked where's piper the,1.6573710441589355,0.00040149688720703125,68328
314,0314.wav,5,0,4,1.5,6,where's the pickled peppers peter picked,the where's where's of peck of the peppers picked of the,1.688969612121582,0.00014901161193847656,68328
315,0315.wav,3,0,2,1.6666666666666667,3,picked a peter,peck the of peter peter the,1.0820527076721191,8.916854858398438e-05,45228
316,0316.wav,2,0,4,1.2,5,picked a peppers peck peter,peck the where's the peppers picked the,1.6069281101226807,0.0004360675811767578,66648
317,0317.wav,5,0,2,2.3333333333333335,3,pickled peppers piper,picked the of pickled of where's where's the,1.0879676342010498,0.00012063980102539062,45228
318,0318.wav,2,0,1,1.0,3,pickled the pickled,peck where's the peck pickled,0.89967942237854,8.082389831542969e-05,37458
319,0319.wav,4,0,1,1.25,4,of peter where's pickled,pickled of peter picked where's picked a where's,0.9431502819061279,9.250640869140625e-05,39348
320,0320.wav,7,0,1,2.6666666666666665,3,where's peter piper,picked the where's pickled where's picked of piper picked the,2.144207715988159,0.0007257461547851562,73578
321,0321.wav,4,0,3,1.75,4,a peck of peppers,the the where's pickled of of where's the,1.5316624641418457,0.0003809928894042969,62868
322,0322.wav,6,0,1,2.3333333333333335,3,pickled peter piper,peck the peck pickled peck peter peter picked the,1.5035772323608398,0.0006244182586669922,59298
323,0323.wav,5,0,1,2.0,3,pickled peter piper,a the pickled picked picked piper picked the,1.9665076732635498,0.0005311965942382812,77148
324,0324.wav,7,0,6,0.7647058823529411,17,peter piper picked a peck of pickled peppers where's the peck of pickled peppers peter piper picked,picked where's the of of of picked of peck of pickled where's where's of peck of pickled where's peter piper of a picked the,5.671000003814697,0.0017294883728027344,173958
325,0325.wav,5,1,2,1.0,8,peter piper picked a peck of pickled peppers,picked the the of piper picked of a of pickled where's the,2.1276838779449463,0.00040650367736816406,88068
326,0326.wav,5,0,7,1.0,12,peter piper picked pickled peppers where's the pickled peppers peter piper picked,the of piper of a peck pickled where's where's picked pickled where's where's of peter picked the,3.3143937587738037,0.0004611015319824219,132798
327,0327.wav,5,0,6,1.375,8,a peck of pickled peppers peter piper picked,the of of pickled pickled where's of where's of where's a peter the,2.1503055095672607,0.0004944801330566406,86178
328,0328.wav,5,0,4,1.0,9,where's the peck of pickled peppers peter piper picked,peck the where's of peck of picked of where's peter where's of a picked,1.9076266288757324,0.0002117156982421875,75468
