,Filename,Insertions,Deletions,Substitutions,WER,Word Count,transcription,Viterbi transcription,Decode speed,Backtrace speed,Forward computations
157,0157.wav,5,1,3,1.0,9,peter piper picked where's the peck of pickled peppers,a peter of peck of picked where's the pickled pickled peck peck picked,3.3122398853302,0.00025200843811035156,145128
158,0158.wav,2,1,2,0.625,8,peter piper picked a peck of pickled peppers,a picked piper peter peck of pickled peck peppers,3.5329205989837646,0.00028133392333984375,155668
159,0159.wav,1,0,1,0.2222222222222222,9,where's the peck of pickled peppers peter piper picked,a peppers the peck of pickled peppers peter piper picked,3.8430685997009277,0.0003590583801269531,168998
160,0160.wav,4,0,3,0.875,8,peter piper picked a peck of pickled peppers,a a of piper of picked of peck of pickled piper where's,3.3719282150268555,0.00025010108947753906,147608
161,0161.wav,3,0,4,0.7777777777777778,9,where's the peck of pickled peppers peter piper picked,a where's of piper of pickled piper where's peter piper of the,3.3149116039276123,0.00024509429931640625,145128
162,0162.wav,3,0,4,1.0,7,peck of pickled peppers peter piper picked,a piper of pickled piper where's picked piper of the,3.44583797454834,0.00028228759765625,150398
163,0163.wav,3,0,3,0.75,8,peter piper picked a peck of pickled peppers,a peter piper of picked of piper of pickled piper where's,3.1202287673950195,0.00023603439331054688,137068
164,0164.wav,4,0,1,1.0,5,peter piper picked pickled peppers,a peter of piper of picked pickled piper where's,2.715045690536499,0.0001850128173828125,118778
165,0165.wav,2,0,1,1.0,3,peter piper picked,a peter picked picked picked,1.754256248474121,0.00010633468627929688,76308
166,0166.wav,2,0,2,0.5,8,peter piper picked a peck of pickled peppers,a the of piper picked of peck of pickled peppers,3.1299121379852295,0.00025653839111328125,137068
167,0167.wav,2,0,1,0.5,6,picked a peck of pickled peppers,a a the of peck of pickled peppers,2.5340871810913086,0.0001811981201171875,110718
168,0168.wav,1,0,1,0.3333333333333333,6,where's the peck of pickled peppers,a where's the picked of pickled peppers,2.293483257293701,0.00015091896057128906,100178
169,0169.wav,1,1,1,0.3,10,peter piper picked a peck where's the peck peter picked,a peter piper picked of peck where's peck peter picked,3.667285442352295,0.0006182193756103516,160938
170,0170.wav,1,0,1,0.4,5,peter piper picked pickled peppers,a picked piper picked pickled peppers,2.782297372817993,0.00019550323486328125,121258
171,0171.wav,3,0,3,0.75,8,peter piper picked pickled peppers where's the peck,a picked piper picked pickled the piper where's where's the piper,3.676609754562378,0.00029778480529785156,160938
172,0172.wav,1,1,1,0.3333333333333333,9,where's the peck of pickled peppers peter piper picked,a where's the peck pickled piper peter piper picked,4.04617166519165,0.0003311634063720703,176748
173,0173.wav,3,1,3,0.875,8,peter piper picked a peck of pickled peppers,a picked of piper picked of peck pickled piper where's,3.2019155025482178,0.00024962425231933594,139858
174,0174.wav,1,2,5,0.47058823529411764,17,peter piper picked a peck of pickled peppers where's the peck of pickled peppers peter piper picked,a picked piper picked of peck pickled peppers where's the pickled pickled pickled peter peter picked,6.0813117027282715,0.0005812644958496094,264168
175,0175.wav,1,0,0,0.5,2,peter piper,a peter piper,2.347989082336426,0.00014853477478027344,102658
176,0176.wav,2,0,1,1.5,2,pickled peppers,a pickled picked where's,1.905344009399414,0.00010418891906738281,84368
177,0177.wav,4,0,0,0.4444444444444444,9,where's the peck of pickled peppers peter piper picked,a where's the peck of pickled of peppers peter a piper picked a,6.536768198013306,0.0006418228149414062,285248
178,0178.wav,2,0,1,1.5,2,pickled peppers,a a where's peppers,1.7214899063110352,0.00010132789611816406,76308
179,0179.wav,3,0,2,0.8333333333333334,6,picked a peck of pickled peppers,a a the of of pickled a pickled peppers,4.457676887512207,0.00035691261291503906,192558
180,0180.wav,2,0,2,0.5,8,peter piper picked a peck of pickled peppers,a peter of peter picked of peck of pickled peppers,3.4744691848754883,0.0002617835998535156,152878
181,0181.wav,2,0,2,0.5,8,the peck of pickled peppers peter piper picked,a the of peck of pickled peppers peter peter the,4.213997840881348,0.0003287792205810547,182018
182,0182.wav,2,0,1,0.75,4,peter picked pickled peppers,a peter of pickled pickled peppers,2.8961362838745117,0.0001823902130126953,126528
183,0183.wav,1,0,0,0.16666666666666666,6,where's the peck of pickled peppers,a where's the peck of pickled peppers,2.963092803955078,0.0001971721649169922,129318
184,0184.wav,1,0,0,0.2,5,a peck of pickled peppers,a of peck of pickled peppers,2.3429081439971924,0.0001628398895263672,102658
185,0185.wav,2,1,2,0.8333333333333334,6,piper picked a peck of peter,a a picked the the peck peter,3.173290252685547,0.0007767677307128906,140788
186,0186.wav,1,1,1,0.5,6,peter pickled a peck of peppers,a peter pickled peck of where's,2.8361599445343018,0.0001952648162841797,123738
187,0187.wav,2,0,0,0.6666666666666666,3,piper pickled peter,a piper a pickled peter,1.897003412246704,0.0001220703125,83438
188,0188.wav,2,0,0,0.4,5,where's peter piper pickled peppers,a where's peter piper a pickled peppers,2.390625238418579,0.0001468658447265625,106378
189,0189.wav,2,0,3,0.8333333333333334,6,piper peter picked peppers picked peter,a piper peter a a where's a peter,2.9468913078308105,0.00021600723266601562,129318
190,0190.wav,5,0,3,0.47058823529411764,17,piper pickled picked peppers of picked a pickled piper the peppers peck of peter peter peck where's,a piper of pickled picked peppers of picked of pickled picked of the picked of where's peck of peter peter peck where's,8.2766854763031,0.0008542537689208984,362128
191,0191.wav,2,0,5,0.4117647058823529,17,a peter the of peck where's piper peter picked pickled picked peppers pickled of peck peppers piper,a of peter pickled of peck where's piper peter a pickled pickled of where's pickled of peck where's piper,9.563573122024536,0.0010020732879638672,417618
192,0192.wav,5,0,3,0.47058823529411764,17,peter picked peppers piper picked peter of where's peck pickled the peck pickled a piper peppers of,a peter picked peter picked piper of picked peter of where's peck pickled the of peck pickled of piper of where's of,9.487591743469238,0.0010912418365478516,412348
193,0193.wav,4,2,4,0.5882352941176471,17,peck piper picked peppers peck the a peter pickled of pickled picked piper of where's peter peppers,a a piper of picked peppers peck pickled peter pickled of pickled peter picked where's where's peter of picked,10.270605564117432,0.003622770309448242,449238
194,0194.wav,2,0,4,0.35294117647058826,17,a picked pickled peck of of picked the peck piper piper peter pickled peter peppers where's peppers,a a pickled peck where's of picked of peck piper of piper of peter pickled peter peppers picked peppers,9.790605545043945,0.002924203872680664,425368
195,0195.wav,1,1,6,1.0,8,peter piper picked a peck of pickled peppers,a the of peppers of picked picked a,4.657794713973999,0.0009286403656005859,203408
196,0196.wav,2,0,4,0.6666666666666666,9,where's the peck of pickled peppers peter piper picked,a where's picked peck of picked piper of picked piper picked,4.340267896652222,0.0010516643524169922,190078
197,0197.wav,7,1,7,0.8823529411764706,17,peter piper picked a peck of pickled peppers where's the peck of pickled peppers peter piper picked,a the picked peck of picked where's peck peck peck peck of where's picked peck peck of picked peck peppers peter pickled picked,6.318143606185913,0.0016889572143554688,277498
198,0198.wav,4,0,7,0.6470588235294118,17,peter piper picked a peck of pickled peppers where's the peck of pickled peppers peter piper picked,a the the of of of pickled peck of pickled peppers where's peck peck of pickled peppers the the pickled picked,5.21494722366333,0.0004088878631591797,226968
199,0199.wav,4,0,6,0.5882352941176471,17,peter piper picked a peck of pickled peppers where's the peck of pickled peppers peter piper picked,a of of peppers picked of peck of pickled peppers where's picked of peck of pickled peppers picked peck peck picked,4.630034685134888,0.0008118152618408203,203408
200,0200.wav,5,1,9,0.8823529411764706,17,peter piper picked a peck of pickled peppers where's the peck of pickled peppers peter piper picked,the of the of of picked peck peck pickled peck where's where's piper peck of picked peck picked picked peck picked,4.672012090682983,0.0003342628479003906,203408
201,0201.wav,2,3,4,0.5294117647058824,17,peter piper picked a peck of pickled peppers where's the peck of pickled peppers peter piper picked,a pickled peck picked pickled picked peppers picked of peck of pickled peppers peter peck picked,4.287153720855713,0.0008337497711181641,187288
202,0202.wav,1,2,0,0.3,10,peppers picked a peck of peter a pickled peter piper,a peppers picked peck of peter pickled peter piper,3.2412683963775635,0.000431060791015625,142338
203,0203.wav,1,1,0,0.11764705882352941,17,peter piper picked a peck of pickled peppers where's the peck of pickled peppers peter piper picked,a peter piper picked peck of pickled peppers where's the peck of pickled peppers peter piper picked,4.9413251876831055,0.0004062652587890625,216428
204,0204.wav,1,0,0,0.14285714285714285,7,peck of pickled peppers peter piper picked,a peck of pickled peppers peter piper picked,2.96557354927063,0.00043487548828125,129318
205,0205.wav,1,0,0,0.14285714285714285,7,peter piper peck peppers picked peter peppers,a peter piper peck peppers picked peter peppers,2.7600600719451904,0.00016808509826660156,121258
206,0206.wav,1,1,0,0.25,8,pickled peter piper a peck the peppers picked,a pickled peter piper peck the peppers picked,2.8973379135131836,0.00016880035400390625,126528
207,0207.wav,2,1,2,0.625,8,peter piper picked a peck of pickled peppers,a peter of piper picked of peck pickled where's,2.762470006942749,0.00022172927856445312,121258
208,0208.wav,2,0,5,0.7777777777777778,9,where's the peck of pickled peppers peter piper picked,a where's of of of picked peppers picked of of picked,2.8341164588928223,0.0002644062042236328,126528
209,0209.wav,1,0,1,0.3333333333333333,6,peter picked piper where's the peck,a peter picked piper where's of peck,2.7265563011169434,0.0003654956817626953,118778
210,0210.wav,3,0,6,1.125,8,pickled peter the peppers a piper where's picked,a a of picked of of of where's of where's picked,2.2237744331359863,0.00011038780212402344,97388
211,0211.wav,1,1,2,0.4444444444444444,9,piper pickled peppers where's a peter picked a peck,a piper of peppers where's of peter picked peck,2.655060052871704,0.00012874603271484375,118778
212,0212.wav,3,0,7,0.5882352941176471,17,peter piper picked a peck of pickled peppers where's the peck of pickled peppers peter piper picked,a peter piper of a peck of pickled peppers where's of pickled pickled peck where's the of peter of a,6.755742788314819,0.0005538463592529297,293308
213,0213.wav,3,2,8,0.8125,16,the peck of pickled peppers peter piper picked peter piper picked a peck of pickled peppers,a a pickled pickled peck where's the of piper a pickled piper picked peck pickled peck where's,6.582620143890381,0.0012598037719726562,288038
214,0214.wav,2,2,6,0.7142857142857143,14,a peck of pickled peppers peter piper picked where's the peck of pickled peppers,a where's pickled pickled where's picked of piper of a where's of pickled where's,8.255115747451782,0.0009644031524658203,359338
215,0215.wav,5,0,10,0.9375,16,a peck of pickled peppers picked peter piper where's peter piper peck of pickled peppers picked,a pickled a where's pickled where's the of piper where's where's the of peter picked of peck pickled peck where's a,8.158124685287476,0.0025072097778320312,354068
216,0216.wav,2,1,9,0.75,16,a peck of peppers pickled picked peter piper where's peter piper peppers pickled the peck picked,a pickled a picked a where's pickled the of piper where's peter where's pickled of piper a,8.88251256942749,0.0010116100311279297,383208
217,0217.wav,1,0,2,0.2727272727272727,11,peter where's a peter picked of piper piper peck pickled picked,a pickled where's of peter picked of piper piper peck pickled picked,5.743103504180908,0.0006563663482666016,250838
218,0218.wav,1,0,0,0.2,5,pickled peter pickled of peck,a pickled peter pickled of peck,4.418245792388916,0.0004417896270751953,192558
219,0219.wav,3,0,3,0.5,12,peppers peppers piper the peck peter picked pickled of pickled piper picked,a where's of where's piper the of peck peter picked pickled of picked piper picked,6.128793478012085,0.001405477523803711,266648
220,0220.wav,4,0,1,0.5555555555555556,9,where's the peck of pickled peppers peter piper picked,a where's the of peck of pickled peter peter of piper of picked,3.258151054382324,0.00020694732666015625,142338
221,0221.wav,5,1,2,0.47058823529411764,17,peck a piper pickled peter of of the peck peter picked piper where's peppers pickled peppers picked,a peck of piper pickled peter of pickled of peck peter peck picked piper where's of where's the pickled peppers picked,7.087360858917236,0.0006272792816162109,309118
222,0222.wav,1,1,1,0.5,6,peppers of piper pickled the peter,a where's of piper pickled peter,2.03104305267334,0.0002741813659667969,89638
223,0223.wav,1,0,0,0.14285714285714285,7,piper picked peter pickled where's the peppers,a piper picked peter pickled where's the peppers,2.205047369003296,0.0002617835998535156,97388
224,0224.wav,1,0,0,0.16666666666666666,6,the peck of piper peter picked,a the peck of piper peter picked,1.6684577465057373,0.00019598007202148438,73518
225,0225.wav,1,0,0,0.14285714285714285,7,piper peter peter piper picked the peppers,a piper peter peter piper picked the peppers,2.352173089981079,0.0002605915069580078,102658
226,0226.wav,1,1,1,0.5,6,where's the piper of peck peter,a where's peppers of peck peter,2.068939685821533,0.00021767616271972656,89638
227,0227.wav,2,0,4,0.8571428571428571,7,peter picked a peck of pickled peppers,a the of picked the peck of picked where's,2.361839771270752,0.00026702880859375,102658
228,0228.wav,2,0,3,0.7142857142857143,7,peter piper picked a peck of peppers,a the of piper the the peck of peppers,2.1187734603881836,0.00023031234741210938,92118
229,0229.wav,3,0,3,1.2,5,where's the peppers peter picked,a where's picked of where's picked of picked,2.071842670440674,0.0005588531494140625,89638
230,0230.wav,3,0,3,1.0,6,where's the peck of pickled peppers,a where's picked peck of the the peck where's,1.9778187274932861,0.0002238750457763672,86848
231,0231.wav,4,0,3,1.0,7,where's the pickled peppers peter piper picked,a where's the the of peppers picked of piper of the,2.3869478702545166,0.0002684593200683594,105448
232,0232.wav,2,0,2,0.23529411764705882,17,peter piper picked a peck of pickled peppers where's the peck of pickled peppers peter piper picked,a peter of piper peck of peck of pickled peppers where's the peck of pickled peppers peter piper picked,4.565582275390625,0.0005383491516113281,198138
233,0233.wav,2,0,3,0.29411764705882354,17,peter piper picked a peck of pickled peppers where's the peck of pickled peppers peter piper picked,a a where's piper peck of peck of pickled peppers where's the peck of pickled peppers peter piper picked,5.128056049346924,0.0005712509155273438,224488
234,0234.wav,3,0,0,0.5,6,peter peter peter peter piper peter,a peter of peter peter peter piper peter of,3.3708975315093994,0.0002129077911376953,147608
235,0235.wav,2,0,0,0.5,4,pickled peppers where's peter,a pickled peppers where's peter a,2.6077585220336914,0.00013303756713867188,115988
236,0236.wav,2,0,4,0.75,8,peter piper picked a peck of pickled peppers,a the of peter picked peck of pickled peck peppers,2.884121894836426,0.00014519691467285156,126528
237,0237.wav,1,0,1,0.6666666666666666,3,the pickled piper,a the pickled peter,2.606046676635742,0.000125885009765625,115988
238,0238.wav,2,0,1,0.6,5,peter piper peck pickled peppers,a the peck piper peck pickled peppers,3.433789014816284,0.0001842975616455078,150398
239,0239.wav,1,1,0,0.25,8,peter piper picked a peck of pickled peppers,a peter piper picked peck of pickled peppers,3.2440929412841797,0.00017070770263671875,142338
240,0240.wav,2,0,2,0.4444444444444444,9,where's the peck of pickled peppers peter piper picked,a picked of peck of pickled peppers peter of piper picked,3.739008665084839,0.0005400180816650391,163728
241,0241.wav,1,0,0,0.16666666666666666,6,peter picked peppers piper pickled peppers,a peter picked peppers piper pickled peppers,3.3013501167297363,0.0001704692840576172,145128
242,0242.wav,1,0,1,0.2857142857142857,7,where's the peck of peppers peter picked,a where's of peck of peppers peter picked,2.5948996543884277,0.0001304149627685547,113198
243,0243.wav,2,0,1,0.42857142857142855,7,where's the peck of peppers piper pickled,a where's picked of peck of peppers piper pickled,2.7134172916412354,0.00016832351684570312,118778
244,0244.wav,4,0,3,1.0,7,peter picked a peck of pickled peppers,a of a of a the of peck of pickled where's,5.1898415088653564,0.00039505958557128906,226968
245,0245.wav,3,0,4,1.4,5,the pickled peppers peter picked,a of picked of where's picked of the,3.6723368167877197,0.00023174285888671875,160938
246,0246.wav,2,0,0,0.6666666666666666,3,where's the piper,a where's the piper where's,2.3517627716064453,0.00011563301086425781,102658
247,0247.wav,1,0,1,0.6666666666666666,3,piper picked peter,a piper pickled peter,3.272747278213501,0.00017213821411132812,142338
248,0248.wav,3,0,2,1.25,4,peter peter piper peppers,a peter picked of piper of where's,3.2929773330688477,0.00043487548828125,145128
249,0249.wav,2,0,1,0.5,6,pickled piper peter peck of peppers,a pickled piper the the peck of peppers,2.552626132965088,0.0003447532653808594,110718
250,0250.wav,1,1,2,0.2222222222222222,18,where's peter of peck picked peppers a piper of pickled the peck picked a piper where's of peck,a where's peter of peck picked where's of piper of pickled the peck picked piper where's of peck,4.83900260925293,0.0006151199340820312,211158
251,0251.wav,3,1,1,0.45454545454545453,11,peck a pickled piper peter of peppers picked the peppers pickled,a peck pickled piper of the where's of peppers picked the peppers pickled,3.0861401557922363,0.00039076805114746094,131798
252,0252.wav,3,0,1,1.3333333333333333,3,where's peter piper,a where's picked of piper a,1.3999736309051514,0.00013566017150878906,60498
253,0253.wav,3,1,4,0.8,10,of peppers where's a peck the pickled peter piper picked,a of where's where's of peck pickled a the of piper peck,2.9687013626098633,0.0005233287811279297,129318
254,0254.wav,1,0,3,0.23529411764705882,17,peter piper picked a peck of pickled peppers where's the peck of pickled peppers peter piper picked,a a picked a picked peck of pickled peppers a the peck of pickled peppers peter piper picked,4.463316917419434,0.0005655288696289062,195348
255,0255.wav,7,1,1,0.5294117647058824,17,peter piper picked a peck of pickled peppers where's the peck of pickled peppers peter piper picked,a a peter of piper a of a of pickled peppers where's the peck of pickled peppers peter piper of picked a a,14.038310289382935,0.0014870166778564453,610748
256,0256.wav,3,1,3,0.4117647058823529,17,peter piper picked a peck of pickled peppers where's the peck of pickled peppers peter piper picked,a peter of piper of a the peck of picked peppers where's peck of pickled peppers picked piper picked,7.907138109207153,0.0009577274322509766,343528
257,0257.wav,4,0,4,0.47058823529411764,17,peter piper picked a peck of pickled peppers where's the peck of pickled peppers peter piper picked,a picked of of of picked of peck of pickled peppers where's the peck of picked of peppers peter piper picked,5.783520221710205,0.0006544589996337891,253628
258,0258.wav,3,1,5,0.5294117647058824,17,peter piper picked a peck of pickled peppers where's the peck of pickled peppers peter piper picked,a picked of of of picked peck picked peppers where's the peck of pickled peppers peter of picked picked,6.266505241394043,0.0006945133209228516,271918
259,0259.wav,4,1,3,0.47058823529411764,17,peter piper picked a peck of pickled peppers where's the peck of pickled peppers peter piper picked,a picked of of of picked peck of pickled of peppers where's the peck of pickled peppers peter of picked,4.439046144485474,0.0004432201385498047,195348
260,0260.wav,4,1,1,1.0,6,peck of pickled peppers peter picked,a peck of picked of peppers picked of a,2.467942714691162,0.00015282630920410156,107928
261,0261.wav,1,0,3,0.8,5,where's the peck peter picked,a where's the picked of a,2.231959819793701,0.00024580955505371094,97388
262,0262.wav,5,0,3,1.6,5,pickled peppers peter piper picked,a a pickled where's the the of of of picked,1.99434232711792,0.00013899803161621094,86848
263,0263.wav,3,0,1,0.6666666666666666,6,peter picked peck of pickled peppers,a a picked of peck peck of pickled peppers,2.527276039123535,0.00018858909606933594,113198
264,0264.wav,2,0,1,0.75,4,where's peter piper peck,a where's picked of piper peck,2.000580310821533,0.00012183189392089844,89638
265,0265.wav,0,0,2,0.6666666666666666,3,piper picked peppers,a picked a,1.8815560340881348,0.00010013580322265625,84368
266,0266.wav,1,1,3,0.8333333333333334,6,where's peter piper pickled picked peppers,a where's of of pickled a,2.6442453861236572,0.00016355514526367188,115988
267,0267.wav,1,0,4,0.8333333333333334,6,the peck of peppers peter picked,a the of of where's the a,1.927807331085205,0.00010180473327636719,84368
268,0268.wav,0,2,2,0.6666666666666666,6,where's the pickled peck of peppers,a the of the,2.0073132514953613,0.0002624988555908203,84368
269,0269.wav,1,0,2,0.6,5,peter piper picked pickled peppers,a peter piper a pickled where's,3.398714542388916,0.0004229545593261719,150398
270,0270.wav,1,0,1,0.6666666666666666,3,peter picked piper,a peter a piper,2.238898754119873,0.00017452239990234375,97388
271,0271.wav,1,0,2,0.75,4,picked peppers picked piper,a a where's picked piper,2.76584529876709,0.00018525123596191406,121258
272,0272.wav,1,0,3,0.6666666666666666,6,where's the pickled peppers piper picked,a where's the picked where's piper a,3.0057432651519775,0.0002472400665283203,131798
273,0273.wav,2,1,5,1.1428571428571428,7,peck of picked peppers piper peter picked,a picked a where's of the the a,3.504333734512329,0.00030875205993652344,155668
274,0274.wav,1,0,0,0.25,4,peter piper picked peppers,a peter piper picked peppers,3.2148854732513428,0.0002262592315673828,140788
275,0275.wav,2,0,0,0.6666666666666666,3,pickled peppers picked,a pickled peppers a picked,2.069950819015503,0.0002257823944091797,92118
276,0276.wav,2,0,1,0.42857142857142855,7,peter piper picked a peck of peppers,a peter piper picked of peck of peck peppers,3.360057830810547,0.0003685951232910156,146678
277,0277.wav,1,0,0,0.25,4,piper picked pickled peppers,a piper picked pickled peppers,2.5501761436462402,0.0002849102020263672,112268
278,0278.wav,1,0,0,0.25,4,peter piper pickled peppers,a peter piper pickled peppers,2.603586435317993,0.0003170967102050781,112268
279,0279.wav,2,0,4,1.5,4,peck the peppers peck,a a picked of where's a,3.1712701320648193,0.0003514289855957031,137998
280,0280.wav,3,0,2,1.0,5,piper the piper pickled peppers,a of a the piper of pickled where's,3.088542938232422,0.000408172607421875,135208
281,0281.wav,4,0,3,1.0,7,peter picked piper picked the picked peppers,a a of picked piper of a the picked a where's,3.1014060974121094,0.0003185272216796875,135208
282,0282.wav,2,0,1,0.6,5,pickled piper peppers pickled peter,a pickled piper of where's pickled peter,2.596630334854126,0.0002751350402832031,113198
283,0283.wav,6,0,8,0.8235294117647058,17,piper peter picked a peck of pickled peppers where's the peck of pickled peppers piper peter picked,a of of the picked the of peck of the picked where's where's the peck of pickled where's piper the the of the,4.127254009246826,0.00040411949157714844,179538
284,0284.wav,0,0,1,0.5,2,the peck,a peck,1.8692617416381836,0.00010466575622558594,81578
285,0285.wav,1,0,0,0.25,4,where's the peck peter,a where's the peck peter,1.9411494731903076,0.00023889541625976562,84368
286,0286.wav,1,0,0,0.3333333333333333,3,piper pickled peppers,a piper pickled peppers,2.084182024002075,0.00022745132446289062,92118
287,0287.wav,3,0,1,0.5,8,a peck of pickled peppers peter piper picked,a of peck of pickled the of where's peter piper picked,2.8565075397491455,0.0003681182861328125,124048
288,0288.wav,2,0,2,0.6666666666666666,6,peppers pickled a peck picked peter,a of where's pickled of peck picked peter,2.7183074951171875,0.000270843505859375,118778
289,0289.wav,1,0,1,0.6666666666666666,3,peter picked peppers,a where's picked peppers,1.6866881847381592,0.00018095970153808594,73518
290,0290.wav,1,0,2,0.75,4,peck of pickled peppers,a picked of pickled where's,1.810230016708374,0.00018334388732910156,79098
291,0291.wav,2,0,1,1.0,3,where's peter piper,a where's a of piper,1.6434144973754883,0.0002243518829345703,71038
292,0292.wav,1,0,0,0.25,4,pickled peck of peppers,a pickled peck of peppers,2.234334945678711,0.00019693374633789062,97388
293,0293.wav,3,1,1,1.0,5,peter piper picked a peck,a where's piper a the peck peck,2.3431968688964844,0.00015687942504882812,102658
294,0294.wav,1,0,0,0.2,5,peppers of piper peck peter,a peppers of piper peck peter,4.4045569896698,0.00048422813415527344,192558
295,0295.wav,1,0,3,0.6666666666666666,6,peter a piper of a peck,a peter of piper of picked of,2.6098337173461914,0.0002944469451904297,113198
296,0296.wav,2,0,0,0.5,4,peck pickled peter peck,a peck pickled peter of peck,2.778054714202881,0.00017714500427246094,121258
297,0297.wav,2,0,2,0.4444444444444444,9,a piper of peter picked peppers of pickled peter,a a piper of peter peck of where's of pickled peter,4.152926445007324,0.0004985332489013672,182018
