,Filename,Insertions,Deletions,Substitutions,WER,Word Count,transcription,Viterbi transcription,Decode speed,Backtrace speed,Forward computations
298,0298.wav,1,0,2,0.6,5,of peck a peter pickled,a of peck picked of pickled,3.0597665309906006,0.0001709461212158203,137068
299,0299.wav,0,0,1,0.14285714285714285,7,piper picked a peck of the peppers,piper picked picked peck of the peppers,1.6237239837646484,9.083747863769531e-05,73518
300,0300.wav,1,0,0,0.3333333333333333,3,where's peter piper,a where's peter piper,1.8076422214508057,9.775161743164062e-05,81578
301,0301.wav,0,0,0,0.0,4,pickled peppers of peter,pickled peppers of peter,1.414771318435669,8.225440979003906e-05,62978
302,0302.wav,1,0,1,0.25,8,a peck of pickled peppers of peter piper,a of peck of pickled where's of peter piper,2.0047695636749268,0.00010728836059570312,89638
303,0303.wav,2,0,2,0.8,5,peppers peppers peppers peppers peppers,peppers of where's peppers peppers of where's,1.946622371673584,0.00010848045349121094,86848
304,0304.wav,1,0,0,0.2,5,peter peck the pickled peppers,a peter peck the pickled peppers,1.767427921295166,9.846687316894531e-05,79098
305,0305.wav,1,1,0,0.4,5,pickled peter picked the piper,a pickled peter picked piper,1.6086091995239258,0.0003440380096435547,71038
306,0306.wav,1,1,0,0.2857142857142857,7,where's the peck of peppers peter picked,a where's peck of peppers peter picked,2.0218026638031006,0.00010824203491210938,89638
307,0307.wav,0,0,2,0.3333333333333333,6,the peppers pickled peter peppers piper,a peppers pickled peter peppers peppers,2.1267213821411133,0.000110626220703125,94908
308,0308.wav,4,0,2,1.0,6,peppers peck peppers picked peppers peter,a of where's peck peppers picked of where's peter the,2.214113235473633,0.00012111663818359375,100178
309,0309.wav,10,0,4,0.875,16,peter piper picked a peck of pickled peppers the peck of pickled peppers peter piper picked,a the picked piper of pickled of peck of pickled peppers where's the peck of picked peppers peter of piper picked of of of picked of,10.041409969329834,0.0010876655578613281,446758
310,0310.wav,8,0,10,1.0588235294117647,17,peter piper picked a peck of pickled peppers where's the peck of pickled peppers peter piper picked,a the picked of piper the a pickled where's peck picked where's where's peck of of peppers peppers peter a the a peck where's peck,7.098551034927368,0.0008499622344970703,314388
311,0311.wav,2,0,1,0.6,5,a peck of pickled peppers,a peck of pickled of where's piper,3.6798593997955322,0.0003275871276855469,163728
312,0312.wav,3,0,1,1.3333333333333333,3,where's peter piper,a where's peter the the a,1.9111607074737549,0.00010204315185546875,84368
313,0313.wav,7,0,3,2.5,4,peter picked pickled peppers,a the the the a the pickled picked the picked where's,2.2576045989990234,0.0001392364501953125,100178
314,0314.wav,5,0,4,1.5,6,where's the pickled peppers peter picked,a of the where's of peck of the peppers picked of,2.2504630088806152,0.00014209747314453125,100178
315,0315.wav,2,1,0,1.0,3,picked a peter,a of of peter,1.4889028072357178,8.177757263183594e-05,66078
316,0316.wav,1,2,1,0.8,5,picked a peppers peck peter,a the peppers picked,2.1886847019195557,0.00011420249938964844,97698
317,0317.wav,2,0,2,1.3333333333333333,3,pickled peppers piper,a pickled of where's where's,1.4977531433105469,8.487701416015625e-05,66078
318,0318.wav,1,0,2,1.0,3,pickled the pickled,a where's the picked,1.250460147857666,6.914138793945312e-05,54608
319,0319.wav,1,0,1,0.5,4,of peter where's pickled,peck of peter where's picked,1.2776708602905273,7.05718994140625e-05,57398
320,0320.wav,3,0,1,1.3333333333333333,3,where's peter piper,a a where's picked of piper,2.392622709274292,0.0001685619354248047,107928
321,0321.wav,2,0,2,1.0,4,a peck of peppers,a a pickled of of where's,2.07525634765625,0.00011587142944335938,92118
322,0322.wav,1,0,1,0.6666666666666666,3,pickled peter piper,a pickled peter peter,1.9615168571472168,0.00010848045349121094,86848
323,0323.wav,2,0,1,1.0,3,pickled peter piper,a pickled picked picked piper,2.5386874675750732,0.0001361370086669922,113198
324,0324.wav,6,1,5,0.7058823529411765,17,peter piper picked a peck of pickled peppers where's the peck of pickled peppers peter piper picked,a a the of of of picked of peck of pickled where's where's peck of pickled where's peter piper of a picked,5.781450510025024,0.0005245208740234375,256108
325,0325.wav,3,1,2,0.75,8,peter piper picked a peck of pickled peppers,a the of piper picked of a of pickled where's,2.9237120151519775,0.0003292560577392578,129318
326,0326.wav,3,0,8,0.9166666666666666,12,peter piper picked pickled peppers where's the pickled peppers peter piper picked,a the of piper of a picked where's where's pickled where's where's of peter picked,4.390078544616699,0.00031948089599609375,195348
327,0327.wav,2,1,4,0.875,8,a peck of pickled peppers peter piper picked,a of pickled pickled where's where's of where's a,2.8205413818359375,0.00030493736267089844,126528
328,0328.wav,2,0,5,0.7777777777777778,9,where's the peck of pickled peppers peter piper picked,a where's of peck of picked of where's peter where's a,2.498054027557373,0.00017309188842773438,110718
