,Filename,Insertions,Deletions,Substitutions,WER,Word Count,transcription,Viterbi transcription,Decode speed,Backtrace speed,Forward computations
0,0000.wav,2,0,0,0.11764705882352941,17,peter piper picked a peck of pickled peppers where's the peck of pickled peppers peter piper picked,pickled peter piper picked a the peck of pickled peppers where's the peck of pickled peppers peter piper picked,7.980441331863403,0.0007066726684570312,354068
1,0001.wav,3,0,1,0.5714285714285714,7,peter picked a peck of pickled peppers,pickled a peter picked the of peck of pickled peppers,4.503545522689819,0.00034427642822265625,200618
2,0002.wav,0,0,1,0.16666666666666666,6,a peck of pickled peppers picked,pickled peck of pickled peppers picked,3.384997606277466,0.00021982192993164062,150398
3,0003.wav,1,0,0,0.25,4,peter piper peter piper,pickled peter piper peter piper,2.5003347396850586,0.0003256797790527344,110718
4,0004.wav,1,1,1,0.42857142857142855,7,where's the peck of pickled peppers picked,pickled where's the pickled pickled peppers picked,3.2336747646331787,0.0001823902130126953,145128
5,0005.wav,0,0,0,0.0,4,peter piper pickled peppers,peter piper pickled peppers,1.9328491687774658,0.00010371208190917969,86848
6,0006.wav,0,0,0,0.0,2,where's peter,where's peter,1.1664268970489502,0.00015473365783691406,52438
7,0007.wav,1,0,0,0.2,5,piper picked peppers of peter,a piper picked peppers of peter,1.9223711490631104,0.00010228157043457031,86848
8,0008.wav,0,0,0,0.0,6,peter peppers picked piper of peck,peter peppers picked piper of peck,2.1580867767333984,0.00011515617370605469,97388
9,0009.wav,0,0,1,0.125,8,a peck of pickled peppers peter piper pickled,a peck of picked peppers peter piper pickled,2.7901134490966797,0.0001506805419921875,124048
10,0010.wav,1,0,0,1.0,1,picked,a picked,1.2237939834594727,6.866455078125e-05,55228
11,0011.wav,1,0,0,1.0,1,pickled,a pickled,1.044330358505249,6.246566772460938e-05,47168
12,0012.wav,1,0,0,1.0,1,peppers,a peppers,1.8369455337524414,9.584426879882812e-05,81578
13,0013.wav,1,0,0,1.0,1,piper,a piper,1.6571509838104248,8.749961853027344e-05,73518
14,0014.wav,1,0,0,1.0,1,peter,a peter,1.4902236461639404,8.034706115722656e-05,65768
15,0015.wav,2,0,0,0.3333333333333333,6,where's the peck of pickled peppers,a where's the peck of the pickled peppers,2.7160096168518066,0.0001418590545654297,121258
16,0016.wav,2,0,0,0.6666666666666666,3,peter piper picked,a peter piper the picked,1.6865947246551514,8.869171142578125e-05,76308
17,0017.wav,2,0,1,0.375,8,peter piper picked a peck of pickled peppers,a peter of piper picked of peck of pickled peppers,3.7845945358276367,0.00023794174194335938,168998
18,0018.wav,2,0,2,0.6666666666666666,6,picked a peck of pickled peppers,a picked the peck of pickled peck where's,1.872119665145874,9.799003601074219e-05,84368
19,0019.wav,3,0,1,1.3333333333333333,3,peter piper picked,a the peck piper a picked,3.439293622970581,0.0001900196075439453,152878
20,0020.wav,4,0,0,0.5714285714285714,7,peppers picked peter piper where's the peck,a peppers picked peter of piper the where's the the peck,4.694860935211182,0.0010981559753417969,208678
21,0021.wav,5,0,1,0.6,10,peter picked a peck piper pickled peppers of pickled peppers,a peter peck picked of peck piper the of pickled the peppers of pickled peppers,6.659329414367676,0.00057220458984375,295788
22,0022.wav,11,0,1,1.5,8,peter piper piper peter peter peter piper piper,a the picked peck piper the of piper the peter picked peter of peter of piper the of piper,4.9655749797821045,0.0005273818969726562,221698
23,0023.wav,2,0,0,0.5,4,peter picked piper peppers,a peter of picked piper peppers,3.247591257095337,0.0002357959747314453,143888
24,0024.wav,2,0,2,0.6666666666666666,6,peter peter peter peter peter peter,a peter peter peter peck peter picked pickled,3.6388134956359863,0.0002980232238769531,160938
25,0025.wav,3,0,2,0.7142857142857143,7,piper picked a peck of peter peppers,a a picked picked of peck of peter peppers a,3.7441647052764893,0.00031447410583496094,166208
26,0026.wav,3,0,2,0.625,8,pickled peppers peter piper picked a peck of,a pickled of where's peter piper picked the peck of a,3.624114751815796,0.00034236907958984375,160938
27,0027.wav,3,0,2,0.625,8,of peppers of picked a peter piper of,a of of where's of picked of peter piper of a,4.420680999755859,0.0004305839538574219,195348
28,0028.wav,3,0,2,1.0,5,pickled peppers peter piper picked,a pickled peppers picked of piper of peck,2.7997236251831055,0.00021839141845703125,124048
29,0029.wav,2,0,2,0.5714285714285714,7,peter picked a peck of pickled peppers,a a picked peck of peck of pickled peppers,2.841557502746582,0.00022792816162109375,126528
30,0030.wav,1,1,2,0.4444444444444444,9,where's a peck of pickled peppers peter piper picked,a where's of peck pickled peppers peter piper peck,3.0393643379211426,0.00023293495178222656,134588
31,0031.wav,2,0,2,0.8,5,peter piper picked the peppers,a picked piper of picked of peppers,1.793992042541504,0.00011444091796875,79098
32,0032.wav,2,0,2,0.8,5,pickled peppers picked peter piper,a pickled peck picked a picked piper,2.0224661827087402,0.00014734268188476562,89638
33,0033.wav,0,0,0,0.0,5,a peck of pickled peppers,a peck of pickled peppers,2.074631690979004,0.00012922286987304688,92118
34,0034.wav,1,0,0,0.2,5,where's the peck peter picked,a where's the peck peter picked,1.5480027198791504,0.0001087188720703125,68248
35,0035.wav,1,0,0,0.25,4,pickled peppers piper picked,a pickled peppers piper picked,2.8380777835845947,0.00021529197692871094,126528
36,0036.wav,1,0,0,0.3333333333333333,3,peter picked peppers,a peter picked peppers,1.578016757965088,0.00010442733764648438,71038
37,0037.wav,1,1,0,0.25,8,peter piper picked a peck of pickled peppers,a peter piper picked peck of pickled peppers,2.655477523803711,0.00020885467529296875,118778
38,0038.wav,2,1,2,0.625,8,peter piper picked a peck of pickled peppers,a peter picked a picked picked picked pickled peppers,2.6099154949188232,0.00018858909606933594,115988
39,0039.wav,1,0,0,0.14285714285714285,7,peppers pickled peter of the piper peck,a peppers pickled peter of the piper peck,2.308258295059204,0.0002422332763671875,102658
40,0040.wav,2,0,1,0.375,8,piper peter picked where's the pickled peppers peter,a peck peter picked where's the pickled peppers peter a,3.1904842853546143,0.00023436546325683594,142338
41,0041.wav,1,0,1,0.2857142857142857,7,peck pickled piper of the peter peppers,a peck pickled picked of the peter peppers,2.4854018688201904,0.0001785755157470703,110718
42,0042.wav,0,0,1,0.09090909090909091,11,a peck of pickled peter picked the peppers of the peck,a peck of pickled peter peck the peppers of the peck,3.0786211490631104,0.0002205371856689453,137068
43,0043.wav,2,0,2,0.5714285714285714,7,where's the peck of peppers piper pickled,a where's of a of peppers piper of pickled,2.6101911067962646,0.0001785755157470703,115988
44,0044.wav,2,0,2,0.5,8,piper pickled peppers of the peck peter picked,a piper of pickled peppers of the piper peter peck,3.0372278690338135,0.0002605915069580078,134588
45,0045.wav,1,0,4,0.8333333333333334,6,piper peter picked pickled piper peppers,a pickled the where's pickled picked peppers,2.9589076042175293,0.000225067138671875,131798
46,0046.wav,5,0,5,0.9090909090909091,11,peter picked peppers of the pickled peck of peppers of piper,a the a of where's of the of pickled peck of peck where's of of the,3.2039308547973633,0.00026154518127441406,142338
47,0047.wav,3,1,3,0.4117647058823529,17,peter piper picked a peck of pickled peppers where's the peck of pickled peppers peter piper picked,a the pickled piper picked peck of picked of peppers where's the peck of picked peppers peter piper picked,5.58483624458313,0.0005037784576416016,248358
48,0048.wav,1,0,1,0.25,8,peter piper picked a peck of pickled peppers,a peter piper picked the peck of pickled peppers,3.0901565551757812,0.00023174285888671875,137068
49,0049.wav,2,0,1,0.3333333333333333,9,where's the peck of pickled peppers peter piper picked,a where's the peck of picked of peppers peter piper picked,2.543303966522217,0.00018739700317382812,113198
50,0050.wav,2,0,2,0.8,5,pickled peppers pickled peter piper,a pickled of where's pickled picked piper,2.4108755588531494,0.00019550323486328125,107928
51,0051.wav,1,1,2,0.36363636363636365,11,peter piper picked a peck of pickled peppers peter piper pickled,a peter piper picked picked of pickled where's peter piper pickled,3.7126455307006836,0.00034236907958984375,163728
52,0052.wav,2,1,1,0.5,8,peter piper picked a peck of pickled peppers,a peter of piper picked peck of pickled where's,2.4026520252227783,0.0002982616424560547,107928
53,0053.wav,1,0,1,0.3333333333333333,6,where's the peck of pickled peppers,a where's of peck of pickled peppers,2.200568199157715,0.0001914501190185547,97388
54,0054.wav,2,0,1,0.75,4,piper peter peppers pickled,a piper of peter where's pickled,1.9652090072631836,0.00013065338134765625,86848
55,0055.wav,6,0,1,0.7777777777777778,9,peter piper picked peter piper picked peter piper picked,a peter of piper of picked peter of of of picked peter piper of picked,2.493642807006836,0.00017690658569335938,110718
56,0056.wav,1,0,1,0.2857142857142857,7,where's the peck of peter piper peppers,a where's the peck of peter piper where's,2.07102632522583,0.00013065338134765625,92118
57,0057.wav,1,2,2,0.625,8,peter piper picked a peck of pickled peppers,a picked piper pickled peck pickled peppers,3.4449126720428467,0.00030803680419921875,152878
58,0058.wav,3,0,2,0.625,8,the peck of pickled peppers picked peter piper,a the peck of the pickled of where's peck peter piper,2.5462794303894043,0.0001838207244873047,113198
59,0059.wav,3,0,1,0.6666666666666666,6,piper picked peter the pickled peppers,a piper of picked peter the pickled picked where's,3.091207265853882,0.0003902912139892578,137068
60,0060.wav,2,0,1,0.6,5,peck piper peter pickled picked,a peck piper peter of pickled peck,2.2015841007232666,0.00013327598571777344,97388
61,0061.wav,1,0,0,0.2,5,peck peppers pickled peter piper,a peck peppers pickled peter piper,2.4679174423217773,0.00019240379333496094,110718
62,0062.wav,5,1,3,0.5294117647058824,17,peter piper picked a peck of pickled peppers where's the peck of pickled peppers peter piper picked,a peter of piper a picked of picked of pickled peppers where's peck of pickled peppers picked of piper a picked,6.324966907501221,0.0006201267242431641,279048
63,0063.wav,2,0,4,0.8571428571428571,7,peter piper picked where's the peck of,a picked of piper a where's of peck pickled,3.570873737335205,0.00027441978454589844,158148
64,0064.wav,3,0,4,0.5833333333333334,12,pickled peppers pickled peppers peter piper picked a peck of pickled peppers,a pickled where's pickled peppers picked of piper a of a peck of picked peppers,5.180623531341553,0.0004737377166748047,230068
65,0065.wav,3,0,2,0.625,8,the peck of pickled peppers peter piper picked,a the of a of pickled peppers peter of piper a,3.7344863414764404,0.00023818016052246094,166828
66,0066.wav,3,0,2,0.625,8,peter piper picked a peck of pickled peppers,a the the of piper picked of peck of pickled peppers,3.4990084171295166,0.00032782554626464844,155358
67,0067.wav,3,0,1,0.5,8,pickled peter peppers pickled peppers piper of piper,a picked of peter the peppers pickled peppers piper of piper,5.260106563568115,0.0005273818969726562,232238
68,0068.wav,1,0,1,0.4,5,pickled where's peck peck peppers,a pickled where's peck picked peppers,3.1730856895446777,0.0002810955047607422,142338
69,0069.wav,2,0,2,0.4444444444444444,9,picked pickled a pickled peter of peppers peppers piper,a pickled pickled of pickled peter of of peppers peppers piper,4.576530694961548,0.0004627704620361328,203408
70,0070.wav,1,0,0,0.25,4,peck peppers picked piper,a peck peppers picked piper,2.6131138801574707,0.00020623207092285156,115988
71,0071.wav,2,0,0,0.4,5,a peter pickled pickled picked,a of peter of pickled pickled picked,2.918452024459839,0.00022649765014648438,129318
72,0072.wav,2,1,5,0.8888888888888888,9,peck peppers picked a picked peter a picked peppers,a of where's picked of a peter of pickled where's,4.788559675216675,0.0004589557647705078,213018
73,0073.wav,1,0,1,0.25,8,peck picked peppers peck picked where's of pickled,a peck picked where's peck picked where's of pickled,3.875359058380127,0.0003464221954345703,172718
74,0074.wav,1,0,1,0.25,8,a peter where's piper the picked picked peppers,a of peter where's piper the pickled picked peppers,3.1755144596099854,0.00045752525329589844,140788
75,0075.wav,2,0,1,0.3333333333333333,9,piper peck of peck pickled picked pickled of peter,a piper of piper of peck pickled picked pickled of peter,3.808812141418457,0.00033211708068847656,169618
76,0076.wav,4,1,3,0.8888888888888888,9,peck of peter peppers pickled peppers of picked peter,a peck of the the of peck where's pickled where's of picked,4.257232904434204,0.00041747093200683594,189768
77,0077.wav,2,0,0,0.2222222222222222,9,peppers peck of peck peter picked a of peppers,a peppers peck of peck peck peter picked a of peppers,5.003981351852417,0.0004425048828125,221698
78,0078.wav,1,0,0,0.1111111111111111,9,a peck of the pickled peppers peter piper picked,a of peck of the pickled peppers peter piper picked,4.008776664733887,0.00032830238342285156,176748
79,0079.wav,1,0,0,0.16666666666666666,6,piper picked peter of the peck,a piper picked peter of the peck,2.8748931884765625,0.0002541542053222656,129318
80,0080.wav,1,0,0,0.125,8,a peter picked peck of picked pickled piper,a peck peter picked peck of picked pickled piper,3.7301406860351562,0.00030541419982910156,166208
81,0081.wav,1,0,0,0.2,5,where's peck peppers of piper,a where's peck peppers of piper,2.843200922012329,0.00023317337036132812,126528
82,0082.wav,1,0,2,1.0,3,piper of peppers,a piper picked where's,3.4315967559814453,0.00025272369384765625,152878
83,0083.wav,2,0,0,0.6666666666666666,3,peter picked piper,a peter picked picked piper,2.5426290035247803,0.00016546249389648438,113198
84,0084.wav,1,4,0,0.5555555555555556,9,where's the peck of pickled peppers peter piper picked,pickled peppers peter of piper picked,1.7378482818603516,0.0001220703125,76308
85,0085.wav,2,1,3,0.5454545454545454,11,the peck of pickled peppers picked a peck of pickled peppers,peck of pickled peppers picked of peck of peck of peck where's,2.332226276397705,0.00013947486877441406,105448
86,0086.wav,3,0,1,0.5,8,peter piper where's the peck of pickled peppers,peter of piper where's of peck of pickled peppers peter piper,2.9669666290283203,0.00020313262939453125,131798
87,0087.wav,1,1,2,0.4444444444444444,9,peter piper peter piper a peck of pickled peppers,peter piper peter piper picked of pickled peck where's,3.39849591255188,0.0003552436828613281,150398
88,0088.wav,0,4,2,0.35294117647058826,17,peter piper picked a peck of pickled peppers where's the peck of pickled peppers peter piper picked,piper picked peck pickled peppers where's the peck pickled where's peter picked picked,3.4984025955200195,0.00030422210693359375,155668
89,0089.wav,4,1,3,0.47058823529411764,17,peter piper picked a peck of pickled peppers where's the peck of pickled peppers peter piper picked,a picked of of the picked peck of pickled peppers where's the peck of picked a peppers peter piper picked,4.155036211013794,0.0004761219024658203,184808
90,0090.wav,3,0,1,0.23529411764705882,17,peter piper picked a peck of pickled peppers where's the peck of pickled peppers peter piper picked,a peter piper picked a peck of pickled peppers where's the peck of pickled picked where's peter piper peck picked,6.164243459701538,0.0017809867858886719,271918
91,0091.wav,1,0,1,0.5,4,where's the peck of,a where's of peck of,1.507364273071289,0.0001723766326904297,65768
92,0092.wav,1,1,0,0.4,5,picked a peck of pickled,a picked peck of pickled,1.627462387084961,0.000118255615234375,73518
93,0093.wav,1,0,0,0.2,5,pickled peppers where's the peck,a pickled peppers where's the peck,1.987703800201416,0.00021886825561523438,86848
94,0094.wav,2,0,1,1.0,3,peter picked peppers,a peter picked peck where's,1.581235647201538,0.00015282630920410156,71038
95,0095.wav,1,1,0,0.4,5,peter pickled a picked peck,a peter pickled picked peck,2.1502811908721924,0.0001850128173828125,94908
96,0096.wav,2,0,0,0.3333333333333333,6,peter picked the peck of peppers,a peter picked the peck peck of peppers,2.1717162132263184,0.000213623046875,94908
97,0097.wav,2,0,1,0.375,8,peter picked a peck of the pickled peppers,a peter piper picked the peck of the pickled peppers,2.857356548309326,0.0002789497375488281,126528
98,0098.wav,2,0,1,0.42857142857142855,7,the peck of peppers peter piper pickled,a the peck of peck where's peter piper pickled,2.0510618686676025,0.00012874603271484375,92118
99,0099.wav,3,0,1,0.36363636363636365,11,the peck pickled peppers picked pickled peter of piper a where's,a the picked piper pickled peppers picked peck pickled peter of piper a where's,5.45933985710144,0.0005621910095214844,243088
100,0100.wav,2,0,0,0.2,10,the picked of piper picked of pickled a peter piper,a the picked of piper picked of pickled a the peter piper,3.8977057933807373,0.00032067298889160156,174268
101,0101.wav,2,0,2,0.2857142857142857,14,peck piper picked of picked pickled of where's a peppers peter peppers peter pickled,a picked piper picked of peter pickled of where's a the peppers peter peppers peter pickled,6.2364418506622314,0.0007226467132568359,277498
102,0102.wav,1,0,0,0.25,4,peppers peck peter pickled,a peppers peck peter pickled,2.440136194229126,0.00019121170043945312,107928
103,0103.wav,1,1,0,0.2857142857142857,7,where's piper picked piper a pickled peppers,a where's piper picked piper pickled peppers,3.229729413986206,0.0003008842468261719,145128
104,0104.wav,4,0,1,0.8333333333333334,6,peter picked peppers of pickled peppers,a peter picked a peppers of pickled picked picked a,3.3015334606170654,0.0003261566162109375,146678
105,0105.wav,1,1,1,0.3333333333333333,9,peter peppers picked piper a peck of pickled peppers,a peter peppers a piper peck of pickled peppers,4.044085502624512,0.00034809112548828125,181088
106,0106.wav,2,1,1,0.5,8,peter piper picked a peck of pickled peppers,a peter piper peck picked peck of pickled where's,3.605076789855957,0.0002703666687011719,160938
107,0107.wav,1,0,2,0.375,8,where's the peck of peppers peter piper picked,a where's the picked of peppers peter piper a,3.3505237102508545,0.00023651123046875,149468
108,0108.wav,1,0,1,0.2857142857142857,7,the peck of pickled peter piper pickled,a peck of pickled peter piper of pickled,2.739828109741211,0.00018286705017089844,123738
109,0109.wav,2,0,0,0.3333333333333333,6,piper peter picked peppers of piper,a piper peter picked peppers of piper a,2.857020854949951,0.0007343292236328125,126528
110,0110.wav,2,0,1,0.375,8,peter peppers picked a piper of the peck,a peter of peppers picked of piper of the peck,2.578667640686035,0.00017547607421875,115988
111,0111.wav,3,0,1,0.6666666666666666,6,peck of picked peter piper picked,a picked of picked peter of piper of picked,2.3061821460723877,0.00018548965454101562,102658
112,0112.wav,2,0,1,0.6,5,picked the peppers peter pickled,a a the peppers peter of pickled,2.2542834281921387,0.0001266002655029297,100178
113,0113.wav,2,0,0,0.2857142857142857,7,the piper of peck peppers peter picked,a the piper of peck peppers peter of picked,2.6008057594299316,0.00017976760864257812,115988
114,0114.wav,0,5,2,0.875,8,piper picked peter a pickled peck of peppers,a where's where's,5.970858573913574,0.000667572021484375,266648
115,0115.wav,2,0,1,1.0,3,where's peter piper,a where's the the piper,2.800922393798828,0.0001685619354248047,124048
116,0116.wav,3,0,6,1.0,9,piper picked the peck of pickled peppers peter picked,a of a picked picked of peck pickled of where's picked picked,3.693298816680908,0.00029754638671875,163728
117,0117.wav,4,0,2,1.5,4,piper picked peter peppers,a piper of picked the the of where's,3.1229469776153564,0.00020503997802734375,139858
118,0118.wav,2,0,3,0.625,8,peter where's the peck of peppers piper picked,a the where's of peck of of where's piper picked,4.93406081199646,0.00043129920959472656,219218
119,0119.wav,4,0,3,1.75,4,piper peck pickled peppers,a a piper of picked where's a where's,3.6115386486053467,0.000263214111328125,160938
120,0120.wav,1,0,1,0.6666666666666666,3,peck pickled peter,a a pickled peter,1.9558751583099365,0.00011610984802246094,86848
121,0121.wav,1,0,1,0.5,4,peter where's the peck,a pickled where's the peck,2.7124476432800293,0.0001971721649169922,121258
122,0122.wav,2,0,1,0.75,4,the peppers peck pickled,a the peck where's peck pickled,2.6695191860198975,0.0001914501190185547,118778
123,0123.wav,2,1,2,0.8333333333333334,6,peter of a peck of peppers,a peter pickled peck of peck where's,2.600235939025879,0.00017309188842773438,115988
124,0124.wav,3,0,1,0.8,5,peter peter peter peter peter,a peter peter picked of peter peter of,2.40057373046875,0.0002002716064453125,107928
125,0125.wav,1,0,0,0.3333333333333333,3,piper picked peter,a piper picked peter,1.7569913864135742,0.00010800361633300781,79098
126,0126.wav,3,0,3,1.5,4,piper peppers peter picked,a of peck of peter of the,2.1114797592163086,0.0001347064971923828,94908
127,0127.wav,0,1,1,0.4,5,a peck of pickled peppers,a peck pickled a,2.265561819076538,0.00013375282287597656,100178
128,0128.wav,1,0,0,0.3333333333333333,3,piper pickled pickled,a piper pickled pickled,1.8490877151489258,0.00011229515075683594,81578
129,0129.wav,3,0,3,0.75,8,peter piper picked a peck of pickled peppers,a picked of piper picked of peck of pickled pickled where's,2.7126190662384033,0.0007212162017822266,121258
130,0130.wav,3,0,2,0.5555555555555556,9,where's the peck of pickled peppers peter piper picked,a where's the peck of pickled where's peter of piper of a,3.13431453704834,0.00022172927856445312,139858
131,0131.wav,4,0,2,1.2,5,peter picked piper pickled peppers,a picked of picked piper of pickled of where's,2.1918115615844727,0.0001437664031982422,97388
132,0132.wav,1,0,0,0.5,2,where's peter,a where's peter,1.137737512588501,6.508827209472656e-05,49958
133,0133.wav,3,0,1,1.3333333333333333,3,piper pickled peppers,a piper of pickled peck where's,1.6837329864501953,0.00010657310485839844,76308
134,0134.wav,3,0,2,1.0,5,peter piper picked a peck,a picked of piper peck a of peck,1.8130464553833008,9.870529174804688e-05,81578
135,0135.wav,2,0,2,0.5714285714285714,7,a peck of pickled peppers peter picked,a of where's of pickled peck where's peter picked,3.1250507831573486,0.0002353191375732422,139858
136,0136.wav,5,0,1,1.0,6,where's the peck of pickled peppers,a where's the peck peck of a pickled picked picked where's,2.903237819671631,0.00021219253540039062,129318
137,0137.wav,1,0,3,0.8,5,pickled peppers picked peter piper,a peck where's picked of piper,2.461408853530884,0.00015878677368164062,107928
138,0138.wav,2,1,1,0.6666666666666666,6,peter piper where's the peck picked,a peter piper picked the a peck,3.1656556129455566,0.0002543926239013672,139858
139,0139.wav,3,1,3,0.875,8,peter piper picked a peck of pickled peppers,a picked of of of pickled peck picked pickled peppers,2.698460340499878,0.00016736984252929688,118778
140,0140.wav,3,0,6,1.125,8,peter piper picked a peck of pickled peppers,a the of of of pickled peck picked pickled peck where's,2.349177122116089,0.00013136863708496094,105448
141,0141.wav,2,0,3,0.625,8,a peck of pickled peppers peter piper picked,a peck of pickled peck of the the of picked,2.110384941101074,0.00012040138244628906,94908
142,0142.wav,2,0,3,0.5555555555555556,9,where's the peck of pickled peppers peter piper picked,a where's the peck of pickled of picked of of picked,2.1070852279663086,0.0001227855682373047,94908
143,0143.wav,0,0,2,0.25,8,a peck of pickled peppers peter piper picked,a peck of pickled peppers the of picked,1.8742942810058594,0.00010991096496582031,84368
144,0144.wav,1,1,1,0.375,8,peter piper picked a peck of pickled peppers,a peter peter a peck of pickled peppers,3.6848034858703613,0.0002620220184326172,163728
145,0145.wav,5,0,4,1.0,9,where's the peck of pickled peppers peter piper picked,a a picked the peck of the pickled piper where's the picked peck of,5.126672029495239,0.00044345855712890625,226968
146,0146.wav,1,0,0,0.3333333333333333,3,where's peter piper,a where's peter piper,3.0356874465942383,0.00020051002502441406,134588
147,0147.wav,3,0,1,1.3333333333333333,3,where's pickled peppers,a where's the pickled peck where's,2.3187146186828613,0.0001327991485595703,102658
148,0148.wav,3,0,1,1.0,4,peter picked pickled peppers,a peter picked the pickled peck where's,2.9399678707122803,0.00018930435180664062,131798
149,0149.wav,1,0,1,0.3333333333333333,6,peter picked a peck of peppers,a peter picked of peck of peppers,2.429433822631836,0.00016069412231445312,107928
150,0150.wav,1,0,1,0.3333333333333333,6,peter picked a peck of peppers,a peter picked of peck of peppers,2.303337812423706,0.00013566017150878906,102658
151,0151.wav,1,0,0,0.1111111111111111,9,where's the peck of pickled peppers peter piper picked,a where's the peck of pickled peppers peter piper picked,3.376767635345459,0.0009000301361083984,150398
152,0152.wav,1,0,1,0.4,5,where's the peppers peter picked,a where's of peppers peter picked,2.317485809326172,0.00013017654418945312,102658
153,0153.wav,1,0,1,0.25,8,where's the peck of peppers peter piper picked,a where's of peck of peppers peter piper picked,2.819936990737915,0.00018358230590820312,126528
154,0154.wav,2,0,2,0.5,8,peter piper picked a peck of pickled peppers,a picked picked piper picked of peck of pickled peppers,3.149319648742676,0.00021219253540039062,139858
155,0155.wav,1,0,0,0.2,5,a peck of pickled peppers,a of peck of pickled peppers,2.461987018585205,0.00014162063598632812,110718
156,0156.wav,4,0,3,1.75,4,peter piper picked peppers,a the of piper of peter peck of,2.3255436420440674,0.00013756752014160156,102658
