,Filename,Insertions,Deletions,Substitutions,WER,Word Count,transcription,Viterbi transcription,Decode speed,Backtrace speed,Forward computations
283,0283.wav,5,0,8,0.7647058823529411,17,piper peter picked a peck of pickled peppers where's the peck of pickled peppers piper peter picked,the where's peter the of peck of the picked where's where's the peck of pickled where's piper the the of the the,3.128570556640625,0.001399993896484375,122088
284,0284.wav,1,0,0,0.5,2,the peck,the peck the,1.8779754638671875,0.00019931793212890625,55728
285,0285.wav,3,0,0,0.75,4,where's the peck peter,the where's the peck peter picked the,1.4402234554290771,0.0002601146697998047,57618
286,0286.wav,2,0,1,1.0,3,piper pickled peppers,the piper pickled where's the,1.4327330589294434,0.00024628639221191406,62868
287,0287.wav,4,0,2,0.75,8,a peck of pickled peppers peter piper picked,the of peck of pickled the of where's peter piper picked the,2.1664929389953613,0.0004391670227050781,84498
288,0288.wav,2,0,1,0.5,6,peppers pickled a peck picked peter,the peppers pickled of peck picked peter the,2.0731265544891357,0.0003960132598876953,80928
289,0289.wav,1,0,1,0.6666666666666666,3,peter picked peppers,picked where's picked peppers,1.2577362060546875,0.0002410411834716797,50268
290,0290.wav,1,0,1,0.5,4,peck of pickled peppers,peck of pickled where's the,1.8652212619781494,0.0005650520324707031,54048
291,0291.wav,4,0,1,1.6666666666666667,3,where's peter piper,the where's a of piper picked the,1.1996784210205078,9.250640869140625e-05,48588
292,0292.wav,1,0,0,0.25,4,pickled peck of peppers,pickled peck of peppers the,2.4885175228118896,0.0003390312194824219,66438
293,0293.wav,4,1,1,1.2,5,peter piper picked a peck,picked where's piper a the peck peck the,1.6279115676879883,0.00016069412231445312,70008
294,0294.wav,3,0,1,0.8,5,peppers of piper peck peter,the where's of piper peck peter where's the,5.011287212371826,0.0006983280181884766,130908
295,0295.wav,5,0,1,1.0,6,peter a piper of a peck,where's the peter of piper of picked a peck the the,2.642467498779297,0.000453948974609375,77148
296,0296.wav,3,0,1,1.0,4,peck pickled peter peck,the peck pickled picked of peck the,2.843902111053467,0.0009710788726806641,82608
297,0297.wav,4,0,1,0.5555555555555556,9,a piper of peter picked peppers of pickled peter,pickled a piper the of peter picked of where's of pickled peter the,2.9448134899139404,0.0006053447723388672,123768
298,0298.wav,2,0,2,0.8,5,of peck a peter pickled,the of peck picked of pickled the,3.0354440212249756,0.000514984130859375,93318
299,0299.wav,1,0,1,0.2857142857142857,7,piper picked a peck of the peppers,piper picked picked peck of the peppers the,1.8993241786956787,0.00027251243591308594,50268
300,0300.wav,2,0,0,0.6666666666666666,3,where's peter piper,the where's peter piper the,2.106025218963623,0.00022101402282714844,55728
301,0301.wav,2,0,0,0.5,4,pickled peppers of peter,pickled peppers of peter picked the,1.747797966003418,0.0002570152282714844,43128
302,0302.wav,3,0,2,0.625,8,a peck of pickled peppers of peter piper,the of peck of pickled where's of peter piper the the,1.3980515003204346,0.0004799365997314453,61188
303,0303.wav,3,0,2,1.0,5,peppers peppers peppers peppers peppers,peppers of where's peppers peppers of where's the,1.3343408107757568,0.0003018379211425781,59298
304,0304.wav,1,0,0,0.2,5,peter peck the pickled peppers,the peter peck the pickled peppers,1.382979154586792,0.00030159950256347656,54048
305,0305.wav,1,1,0,0.4,5,pickled peter picked the piper,pickled peter picked piper peck,1.2404310703277588,0.00018334388732910156,48588
306,0306.wav,1,1,0,0.2857142857142857,7,where's the peck of peppers peter picked,the where's peck of peppers peter picked,2.0162951946258545,0.00027823448181152344,61188
307,0307.wav,2,0,2,0.6666666666666666,6,the peppers pickled peter peppers piper,picked peppers pickled peter peppers a picked the,1.6538734436035156,0.00040793418884277344,64758
308,0308.wav,5,0,2,1.1666666666666667,6,peppers peck peppers picked peppers peter,peck of where's peck peppers picked of where's peter the the,1.812002182006836,0.00032806396484375,68328
309,0309.wav,12,0,4,1.0,16,peter piper picked a peck of pickled peppers the peck of pickled peppers peter piper picked,the picked the picked piper of pickled of peck of pickled peppers where's the peck of picked peppers peter of piper picked the of the of pickled of,7.894806385040283,0.002467632293701172,303108
310,0310.wav,11,0,10,1.2352941176470589,17,peter piper picked a peck of pickled peppers where's the peck of pickled peppers peter piper picked,the the of the picked of piper the a pickled where's peck picked where's where's peck of of peppers peppers peter a the of peck where's peck the,5.483798503875732,0.0018682479858398438,213438
311,0311.wav,9,0,1,2.0,5,a peck of pickled peppers,of a where's the the of peck of pickled of where's piper the the,2.7097578048706055,0.000499725341796875,111378
312,0312.wav,4,0,1,1.6666666666666667,3,where's peter piper,picked where's peter the the a the,1.482478141784668,0.00011110305786132812,57618
313,0313.wav,8,0,3,2.75,4,peter picked pickled peppers,the the the a the pickled picked the picked where's piper the,1.7134552001953125,0.0002644062042236328,68328
314,0314.wav,5,0,4,1.5,6,where's the pickled peppers peter picked,the where's where's of peck of the peppers picked of the,1.7118842601776123,0.0003609657287597656,68328
315,0315.wav,3,0,2,1.6666666666666667,3,picked a peter,peck the of peter peter the,1.135411024093628,0.00020265579223632812,45228
316,0316.wav,2,0,4,1.2,5,picked a peppers peck peter,peck the where's the peppers picked the,2.048219919204712,0.00030517578125,66648
317,0317.wav,4,0,2,2.0,3,pickled peppers piper,peck the pickled of where's where's the,1.5237219333648682,0.000225067138671875,45228
318,0318.wav,1,0,1,0.6666666666666666,3,pickled the pickled,peck where's the pickled,1.0159637928009033,0.0005216598510742188,37458
319,0319.wav,2,0,0,0.5,4,of peter where's pickled,peck of peter picked where's pickled,0.8955926895141602,0.0001277923583984375,39348
320,0320.wav,6,0,1,2.3333333333333335,3,where's peter piper,the where's pickled where's picked of piper picked the,1.6804749965667725,0.00029587745666503906,73578
321,0321.wav,2,0,3,1.25,4,a peck of peppers,the pickled of of where's the,2.169299602508545,0.0003399848937988281,62868
322,0322.wav,3,0,1,1.3333333333333333,3,pickled peter piper,the pickled peter peter picked the,1.5526032447814941,0.0003113746643066406,59298
323,0323.wav,4,0,1,1.6666666666666667,3,pickled peter piper,the pickled picked picked piper picked the,1.8755521774291992,0.0003898143768310547,77148
324,0324.wav,6,1,5,0.7058823529411765,17,peter piper picked a peck of pickled peppers where's the peck of pickled peppers peter piper picked,peppers the of of of picked of peck of pickled where's where's peck of pickled where's peter piper of a picked the,5.0906548500061035,0.0007035732269287109,173958
325,0325.wav,3,1,2,0.75,8,peter piper picked a peck of pickled peppers,the of piper picked of a of pickled where's the,3.0419440269470215,0.0004839897155761719,88068
326,0326.wav,3,0,8,0.9166666666666666,12,peter piper picked pickled peppers where's the pickled peppers peter piper picked,the of piper of a picked where's where's pickled where's where's of peter picked the,5.1364946365356445,0.0007243156433105469,132798
327,0327.wav,3,1,4,1.0,8,a peck of pickled peppers peter piper picked,the of pickled pickled where's where's of where's picked the,3.262526750564575,0.0004892349243164062,86178
328,0328.wav,4,0,4,0.8888888888888888,9,where's the peck of pickled peppers peter piper picked,peck the where's of peck of the of where's peter where's a picked,1.6960818767547607,0.0003554821014404297,75468
